{
  "orderId": "foreman-sample-001",
  "buyer": {
    "name": "Internal validation sample",
    "contact": "local-only"
  },
  "sku": "launch_readiness_pack",
  "priceUSDT": 0,
  "paymentStatus": "sample_not_paid",
  "project": {
    "name": "Foreman",
    "category": "Software Utility",
    "summary": "Foreman turns raw launch material into an OKX.AI-ready launch package.",
    "repoUrl": "local-validation",
    "liveUrl": "local-validation"
  },
  "deadline": "2026-07-04T23:59:00Z",
  "rawMaterials": [],
  "deliverables": [
    "readiness_check",
    "demo_shotlist",
    "announcement_post",
    "delivery_receipt"
  ],
  "scope": "Create a sample Launch Readiness Pack for Foreman with a readiness check, 90-second demo shotlist, announcement post, and delivery receipt. This is not a paid customer order and must not be counted as revenue.",
  "revisionPolicy": "One revision included for paid customer orders.",
  "warranty": "If the delivered asset misses the written scope and we cannot fix it within the revision window, we refund the service fee."
}
